id,iyear,imonth,iday,country_txt,region_txt,provstate,city,latitude,longitude,summary,crit1,crit2,crit3,doubtterr,alternative,alternative_txt,success,suicide,attacktype1,attacktype1_txt,attacktype2_txt,targtype1_txt,targsubtype1_txt,corp1,target1,natlty1_txt,targtype2_txt,targsubtype2_txt,target2,natlty2_txt,gname,motive,nperps,weaptype1_txt,weapsubtype1_txt,weaptype2_txt,weapsubtype2_txt,weapdetail,nkill,nwound
36,2015,1,7,France,Western Europe,Ile-de-France,Paris,48.859172,2.370553,"01/07/2015: Two assailants stormed the offices of Charlie Hebdo, a satirical magazine, in the 11th arrondissement of Paris, Ile-de-France region, France. The attackers opened fire on journalists and building security, killing 11 people and injuring 11 others. The assailants fled following the raid, but continued shooting at police vehicles outside of the building and several blocks away; one police officer was killed in the street attack. The gunmen abandoned their vehicle several kilometers from the magazine offices, hijacked a second vehicle and injured the driver, before they disappeared for the remainder of the day. Al-Qa`ida in the Arabian Peninsula (AQAP) claimed responsibility for the incident, stating that the attack was in retaliation for the magazine's depiction of Prophet Muhammad. The two assailants were identified as brothers Cherif Kouachi and Said Kouachi.",1,1,1,0,,.,1,0,5,Hostage Taking (Barricade Incident),Armed Assault,Journalists & Media,Newspaper Journalist/Staff/Facility,Charlie Hebdo,Offices,France,Police,Police Security Forces/Officers,Officer: Ahmed Merabet,France,Al-Qaida in the Arabian Peninsula (AQAP),Al-Qa`ida in the Arabian Peninsula (AQAP) claimed responsibility for the incident and stated that the attack was carried out in retaliation for Charlie Hebdo's continuous publication of images of the Prophet Muhammad.,2,Explosives/Bombs/Dynamite,"Projectile (rockets, mortars, RPGs, etc.)",Firearms,Automatic Weapon,"A grenade launcher, Kalashnikov assault rifles, and pistols were used in the attack.",12,12
37,1974,5,28,Italy,Western Europe,Lombardy,Brescia,45.539838,10.222956,,1,1,1,0,,.,1,0,3,Bombing/Explosion,.,Government (General),Politician or Political Party Movement/Meeting/Rally,,Leftist Meeting,Italy,.,.,,.,Black Order,,,Explosives/Bombs/Dynamite,Unknown Explosive Type,.,.,Explosive,11,0
38,1987,11,7,United Kingdom,Western Europe,Northern Ireland,Enniskillen,54.346531,-7.640404,,1,1,1,0,,.,1,0,3,Bombing/Explosion,.,Government (General),"Government Personnel (excluding police, military)",Govt.,Remembrance Day Celebration,Northern Ireland,.,.,,.,Irish Republican Army (IRA),,,Explosives/Bombs/Dynamite,Vehicle,.,.,Explosive,11,61
39,1987,12,11,Spain,Western Europe,Zaragoza,Zaragoza,41.656285,-0.876533,,1,1,1,0,,.,1,0,3,Bombing/Explosion,.,Police,"Police Building (headquarters, station, school)",Civil guard,Civil guard family housing,Spain,.,.,,.,Basque Fatherland and Freedom (ETA),,,Explosives/Bombs/Dynamite,Vehicle,.,.,Explosive,11,24
40,1989,9,22,United Kingdom,Western Europe,England,Deal,51.22181,1.402734,,1,1,0,1,1,Insurgency/Guerilla Action,1,0,3,Bombing/Explosion,.,Military,Military Barracks/Base/Headquarters/Checkpost,military,"barracks, Royal Marines School of Music",Great Britain,.,.,,.,Irish Republican Army (IRA),,,Explosives/Bombs/Dynamite,Unknown Explosive Type,.,.,Explosive,11,30
41,1974,11,21,United Kingdom,Western Europe,England,Birmingham,52.482961,-1.893592,,1,1,1,0,,.,1,0,3,Bombing/Explosion,.,Business,Restaurant/Bar/Caf’©,,2 Pubs,Great Britain,.,.,,.,Irish Republican Army (IRA),,,Explosives/Bombs/Dynamite,Unknown Explosive Type,.,.,Explosive,10,81
42,1976,1,5,United Kingdom,Western Europe,Northern Ireland,Kingsmill,54.62713,-6.655224,,1,1,1,0,,.,1,0,1,Assassination,.,Private Citizens & Property,Religion Identified,,Ten Protestants in minibus,Northern Ireland,.,.,,.,Republican Action Force,,5,Firearms,Automatic Weapon,.,.,Automatic firearm,10,0
43,1980,3,10,Italy,Western Europe,Lazio,Rome,41.89052,12.494249,,1,1,1,0,,.,1,0,3,Bombing/Explosion,.,Airports & Aircraft,Airline Officer/Personnel,,Turkish Airlines Offices,Italy,.,.,,.,Armenian Secret Army for the Liberation of Armenia,,,Explosives/Bombs/Dynamite,Unknown Explosive Type,.,.,Explosive,10,12
44,1988,7,12,Greece,Western Europe,Attica,Aegina,37.746798,23.426758,,1,1,1,0,,.,1,0,2,Armed Assault,.,Maritime,Commercial Maritime,Ferry Co.,City of Porras Ferry,Greece,.,.,,.,Hezbollah,,7,Explosives/Bombs/Dynamite,Grenade,Chemical,Automatic Weapon,Automatic firearm; Explosives,10,80
45,2007,11,7,Finland,Western Europe,Uusimaa,Tuusula,60.40393,25.026451,"11/07/2007: A student carried out a school shooting, said to be modeled on the Columbine (c.f. 199904200004) and Virginia Tech school shootings, in Tuusula, Finland. He killed seven students, a teacher, and himself, with a handgun.",1,1,1,1,2,Other Crime Type,1,1,2,Armed Assault,.,Educational Institution,School/University/Educational Building,Jokela High School,Students and teachers in the Jokela High School,Finland,.,.,,.,Unaffiliated Individual(s),"According to news sources, the perpetrator posted videos on YouTube shortly before the shooting outlining his intentions, which included the elimination of ""disgraces of human race and failures of natural selection.""  However, many believe that the specific goal was to carry out a copy-cat shooting of the Virginia Tech Shooting in April 2007.",1,Firearms,Handgun,.,.,The perpetrator had just registered his hand gun three weeks before the shooting.,9,
46,1972,7,31,United Kingdom,Western Europe,Northern Ireland,Claudy,54.910864,-7.15523,,1,1,1,0,,.,1,0,3,Bombing/Explosion,.,Private Citizens & Property,Unnamed Civilian/Unspecified,Main Street,nine civilians,Northern Ireland,.,.,,.,Irish Republican Army (IRA),,,Explosives/Bombs/Dynamite,Vehicle,.,.,Car bomb,9,
47,1977,1,24,Spain,Western Europe,Madrid,Madrid,40.416691,-3.700345,,1,1,1,0,,.,1,0,2,Armed Assault,.,Business,.,Workers commissions,"Su source document, Lawyers",Spain,.,.,,.,Argentine Anticommunist Alliance (AAA),,,Firearms,Automatic Weapon,.,.,Automatic firearm,9,0
48,1978,10,5,France,Western Europe,Provence-Alpes-Cote d'Azur,Marseilles,43.296482,5.36978,,1,1,1,0,,.,1,0,2,Armed Assault,.,Unknown,.,,,France,.,.,,.,unidentified attackers,,,Firearms,Handgun,.,.,Pistol,9,0
49,1980,8,8,Ireland,Western Europe,Donegal,Donegal,54.654487,-8.110714,,1,1,1,0,,.,1,0,7,Facility/Infrastructure Attack,.,Business,Hotel/Resort,,Hotel,Ireland,.,.,,.,Irish Republican Army (IRA),,,Incendiary,.,.,.,Incendiary,9,8
50,1985,2,28,United Kingdom,Western Europe,Northern Ireland,Newry,54.18006,-6.33393,,1,1,1,0,,.,1,0,3,Bombing/Explosion,.,Police,"Police Building (headquarters, station, school)",,Ulster police base,Northern Ireland,.,.,,.,Irish Republican Army (IRA),,,Explosives/Bombs/Dynamite,"Projectile (rockets, mortars, RPGs, etc.)",.,.,Mortar,9,0